{
  "format": "HBBA-SCENARIO-3",
  "inference_status": "insufficient_data",
  "title": "Человек резко ушёл",
  "summary": "Наблюдаемое действие известно, но HBBA не выбирает автоматически страх или избегание как скрытую причину.",
  "behaviors": [
    "avoidance"
  ],
  "observations": [
    {
      "id": "obs1",
      "text": "Человек резко ушёл из места взаимодействия.",
      "kind": "direct_observation"
    }
  ],
  "active_nodes": [
    {
      "id": "act_withdraw",
      "claim_scope": "observed",
      "role": "Наблюдаемое действие: уход/увеличение дистанции.",
      "reason": "Уход прямо указан в наблюдении; его мотив не установлен.",
      "based_on": [
        "obs1"
      ]
    }
  ],
  "active_edges": [],
  "alternatives": [
    "Goal-directed: человек сознательно завершил взаимодействие ради другой цели.",
    "Learned/habitual: уход мог быть привычной реакцией, сформированной предыдущим опытом.",
    "Situational: человек мог уходить из-за внешнего ограничения или потому, что направлялся в другое место."
  ],
  "unknowns": [
    "Была ли непосредственная или потенциальная угроза?",
    "Что человек сообщил о своей цели или внутреннем состоянии?",
    "Был ли уход реакцией на событие или совпал с заранее запланированным действием?"
  ],
  "tour_steps": [
    {
      "id": "step1",
      "title": "Начинаем с факта",
      "narration": "HBBA фиксирует только наблюдаемое: человек ушёл. Ни страх, ни тревога, ни мотив пока не добавляются как факт.",
      "look_at": "на единственную наблюдаемую ноду",
      "nodes": [
        "act_withdraw"
      ],
      "edges": [],
      "focus_node": "act_withdraw"
    }
  ]
}
